<?xml version='1.0' encoding='utf-8'?>
<!DOCTYPE list SYSTEM "events.dtd">
<list>
	<event id="84" name="Oren Dominion" impl="DominionSiege">
		<on_init>
			<init name="doors" />
			<spawn name="catapult" />
			<init name="siege_zones" />
			<init name="flag_zones" />
		</on_init>
		<on_start>
			<refresh name="doors" />
			<refresh name="mass_gatekeeper" />
			<despawn name="catapult" />
			<active name="siege_zones"/>
			<teleport_players id="owner" />
			<teleport_players id="from_residence_to_town_except_defenders" />
		</on_start>
		<on_stop>
			<refresh name="doors" />
			<refresh name="mass_gatekeeper" />
			<spawn name="catapult" />
			<teleport_players id="from_residence_to_town_except_defenders" />
			<deactive name="siege_zones" />
		</on_stop>
		<on_time>
			<on time="300">
				<give_item id="-300" count="-1" />
			</on>
			<on time="600">
				<give_item id="-300" count="-1" />
			</on>
			<on time="900">
				<give_item id="-300" count="-1" />
			</on>
			<on time="1200">
				<give_item id="-300" count="-1" />
			</on>
			<on time="1500">
				<give_item id="-300" count="-1" />
			</on>
			<on time="1800">
				<give_item id="-300" count="-1" />
			</on>
			<on time="2100">
				<give_item id="-300" count="-1" />
			</on>
			<on time="2400">
				<give_item id="-300" count="-1" />
			</on>
			<on time="2700">
				<give_item id="-300" count="-1" />
			</on>
			<on time="3000">
				<give_item id="-300" count="-1" />
			</on>
			<on time="3300">
				<give_item id="-300" count="-1" />
			</on>
			<on time="3600">
				<give_item id="-300" count="-1" />
			</on>
			<on time="3900">
				<give_item id="-300" count="-1" />
			</on>
			<on time="4200">
				<give_item id="-300" count="-1" />
			</on>
			<on time="4500">
				<give_item id="-300" count="-1" />
			</on>
			<on time="4800">
				<give_item id="-300" count="-1" />
			</on>
			<on time="5100">
				<give_item id="-300" count="-1" />
			</on>
			<on time="5400">
				<give_item id="-300" count="-1" />
			</on>
			<on time="5700">
				<give_item id="-300" count="-1" />
			</on>
			<on time="6000">
				<give_item id="-300" count="-1" />
			</on>
			<on time="6300">
				<give_item id="-300" count="-1" />
			</on>
			<on time="6600">
				<give_item id="-300" count="-1" />
			</on>
			<on time="6900">
				<give_item id="-300" count="-1" />
			</on>
		</on_time>
		<objects name="doors">
			<door id="22190001" />
			<door id="22190002" />
			<door id="22190003" />
			<door id="22190004" />
			<door id="22190005" />
			<door id="22190006" />
			<door id="22190007" />
			<door id="22190008" />
			<door id="22190009" />
		</objects>
		<objects name="siege_zones">
			<zone name="[oren_castle_siege]" />
		</objects>
		<objects name="flag_zones">
			<zone name="[gludio_castle_hq]" />
			<zone name="[dion_castle_hq]" />
			<zone name="[giran_castle_hq]" />
			<zone name="[oren_castle_hq]" />
			<zone name="[aden_castle_hq]" />
			<zone name="[innadrile_castle_hq]" />
			<zone name="[godad_castle_hq]" />
			<zone name="[rune_castle_hq]" />
			<zone name="[schuttgart_castle_hq]" />
		</objects>
		<objects name="territory_npc">
			<spawn_ex name="territory_manager_4" />
		</objects>
		<objects name="catapult">
			<spawn_ex name="Oren_castle_mercenary" />
		</objects>
		<objects name="ward_81">
			<territory_ward item_id="13560" npc_id="36572" x="82750" y="36840" z="-2293" /> <!--Gludio Ward-->
		</objects>
		<objects name="ward_82">
			<territory_ward item_id="13561" npc_id="36573" x="82750" y="36920" z="-2293" /> <!--Dion Ward-->
		</objects>
		<objects name="ward_83">
			<territory_ward item_id="13562" npc_id="36574" x="82750" y="37000" z="-2293" /> <!--Giran Ward-->
		</objects>
		<objects name="ward_84">
			<territory_ward item_id="13563" npc_id="36575" x="82750" y="37080" z="-2293" /> <!--Oren Ward-->
		</objects>
		<objects name="ward_85">
			<territory_ward item_id="13564" npc_id="36576" x="82750" y="37160" z="-2293" /> <!--Aden Ward-->
		</objects>
		<objects name="ward_86">
			<territory_ward item_id="13565" npc_id="36577" x="82750" y="37240" z="-2293" /> <!--Innadril Ward-->
		</objects>
		<objects name="ward_87">
			<territory_ward item_id="13566" npc_id="36578" x="82750" y="37320" z="-2293" /> <!--Goddard Ward-->
		</objects>
		<objects name="ward_88">
			<territory_ward item_id="13567" npc_id="36579" x="82750" y="37400" z="-2293" /> <!--Rune Ward-->
		</objects>
		<objects name="ward_89">
			<territory_ward item_id="13568" npc_id="36580" x="82750" y="37480" z="-2293" /> <!--Schuttgart Ward-->
		</objects>
	</event>
</list>